{
  "schemaVersion": "resume-opportunity-match.v1",
  "promptVersion": "resume-opportunity-match.v1",
  "status": "COMPLETED",
  "resumeAnalysisId": "22222222-2222-4222-8222-222222222222",
  "opportunityAnalysisId": "33333333-3333-4333-8333-333333333333",
  "recommendation": "TAILOR_BEFORE_APPLYING",
  "summary": "Le profil correspond fortement à Angular, au travail en équipe et à l’apprentissage continu. Java est démontré par la formation et les projets pratiques, tandis que MongoDB n’apparaît pas dans le CV. Le CV devrait être adapté pour clarifier la motivation à rejoindre un poste junior full stack malgré une expérience frontend plus avancée.",
  "requirementCoverage": {
    "status": "WARNING",
    "coveragePercent": 71.43,
    "totalRequirements": 8,
    "evaluableRequirements": 7,
    "matched": 4,
    "partial": 2,
    "missing": 1,
    "unknown": 1,
    "mandatory": {
      "matched": 2,
      "partial": 1,
      "missing": 0,
      "unknown": 1
    },
    "preferred": {
      "matched": 0,
      "partial": 0,
      "missing": 0,
      "unknown": 0
    },
    "contextual": {
      "matched": 2,
      "partial": 1,
      "missing": 1,
      "unknown": 0
    },
    "calculationMethod": "MATCHED_1_PARTIAL_0_5_MISSING_0_UNKNOWN_EXCLUDED"
  },
  "requirementMatches": [
    {
      "requirementId": "REQ-001",
      "status": "MATCHED",
      "matchBasis": "PROFESSIONAL_EXPERIENCE",
      "explanation": "Le CV dépasse le niveau minimum demandé : il présente plus de six ans d’expérience professionnelle en développement frontend et une formation full stack en cours.",
      "resumeEvidence": [
        {
          "source": "RESUME",
          "page": 1,
          "excerpt": "Full stack-oriented software developer with 6+ years of professional experience building enterprise web applications, dashboards and API-driven interfaces."
        },
        {
          "source": "RESUME",
          "page": 1,
          "excerpt": "Fullstack Java / Angular / Cybersecurity - TechnofuturTIC | Jan 2026 - Jul 2026"
        }
      ],
      "opportunityEvidence": [
        {
          "source": "OPPORTUNITY",
          "section": "Introduction",
          "excerpt": "Tu sors d’une formation en développement ou tu as déjà une première expérience ?"
        }
      ],
      "confidence": "HIGH",
      "unknownReason": null
    },
    {
      "requirementId": "REQ-002",
      "status": "PARTIAL",
      "matchBasis": "TRAINING",
      "explanation": "Le CV ne présente pas de diplôme informatique, mais montre une formation intensive Java/Angular/Cybersécurité et plusieurs années de projets professionnels web. Le statut exact « autodidacte avec des projets concrets » n’est pas explicitement revendiqué.",
      "resumeEvidence": [
        {
          "source": "RESUME",
          "page": 1,
          "excerpt": "Fullstack Java / Angular / Cybersecurity - TechnofuturTIC | Jan 2026 - Jul 2026"
        },
        {
          "source": "RESUME",
          "page": 1,
          "excerpt": "Full stack-oriented software developer with 6+ years of professional experience building enterprise web applications, dashboards and API-driven interfaces."
        }
      ],
      "opportunityEvidence": [
        {
          "source": "OPPORTUNITY",
          "section": "Ton profil",
          "excerpt": "Diplômé·e en informatique, ingénieur informatique ou autodidacte avec des projets concrets."
        }
      ],
      "confidence": "HIGH",
      "unknownReason": null
    },
    {
      "requirementId": "REQ-003",
      "status": "MATCHED",
      "matchBasis": "PROFESSIONAL_EXPERIENCE",
      "explanation": "Angular est démontré par plusieurs expériences professionnelles et figure dans le titre, le profil, les compétences et les missions.",
      "resumeEvidence": [
        {
          "source": "RESUME",
          "page": 1,
          "excerpt": "UX/UI Designer & Front-End Developer Angular | Proxistore | 2020 - 2024"
        },
        {
          "source": "RESUME",
          "page": 1,
          "excerpt": "Front-End Developer Angular / React & UX | Mediawind | Apr 2024 - Jan 2026"
        }
      ],
      "opportunityEvidence": [
        {
          "source": "OPPORTUNITY",
          "section": "Ton profil",
          "excerpt": "Tu as touché à Angular, Java et/ou MongoDB (même en projet scolaire)."
        }
      ],
      "confidence": "HIGH",
      "unknownReason": null
    },
    {
      "requirementId": "REQ-004",
      "status": "PARTIAL",
      "matchBasis": "TRAINING",
      "explanation": "Java et Spring Boot sont explicitement pratiqués dans la formation et des projets pratiques, mais le CV ne démontre pas encore d’expérience professionnelle backend Java.",
      "resumeEvidence": [
        {
          "source": "RESUME",
          "page": 1,
          "excerpt": "Hands-on Java / Spring Boot, Maven, REST API design, JPA/Hibernate, PostgreSQL/SQL, authentication, JWT/RBAC, OpenID Connect and API protection."
        }
      ],
      "opportunityEvidence": [
        {
          "source": "OPPORTUNITY",
          "section": "Ton profil",
          "excerpt": "Tu as touché à Angular, Java et/ou MongoDB (même en projet scolaire)."
        }
      ],
      "confidence": "HIGH",
      "unknownReason": null
    },
    {
      "requirementId": "REQ-005",
      "status": "MISSING",
      "matchBasis": "NONE",
      "explanation": "MongoDB est mentionné dans l’annonce, mais aucune preuve de pratique de MongoDB n’apparaît dans le CV analysé.",
      "resumeEvidence": [],
      "opportunityEvidence": [
        {
          "source": "OPPORTUNITY",
          "section": "Ton profil",
          "excerpt": "Tu as touché à Angular, Java et/ou MongoDB (même en projet scolaire)."
        }
      ],
      "confidence": "HIGH",
      "unknownReason": null
    },
    {
      "requirementId": "REQ-006",
      "status": "UNKNOWN",
      "matchBasis": "UNKNOWN",
      "explanation": "Le CV ne permet pas d’évaluer de manière fiable la curiosité, la motivation ou l’aisance à poser des questions. Ces éléments nécessitent un échange ou des preuves comportementales supplémentaires.",
      "resumeEvidence": [],
      "opportunityEvidence": [
        {
          "source": "OPPORTUNITY",
          "section": "Ton profil",
          "excerpt": "Tu es curieux·se, motivé·e, et tu n’as pas peur de poser des questions."
        }
      ],
      "confidence": "HIGH",
      "unknownReason": "INSUFFICIENT_CONTEXT"
    },
    {
      "requirementId": "REQ-007",
      "status": "MATCHED",
      "matchBasis": "PROFESSIONAL_EXPERIENCE",
      "explanation": "Le CV fournit des preuves explicites de collaboration avec les équipes backend et les parties prenantes métier.",
      "resumeEvidence": [
        {
          "source": "RESUME",
          "page": 1,
          "excerpt": "collaborated with backend teams on API contracts and data flows."
        },
        {
          "source": "RESUME",
          "page": 1,
          "excerpt": "Worked with business stakeholders to clarify needs, assess feasibility, document interface behaviour and deliver application modifications."
        }
      ],
      "opportunityEvidence": [
        {
          "source": "OPPORTUNITY",
          "section": "Ton profil",
          "excerpt": "Tu aimes travailler en équipe et apprendre en continu."
        }
      ],
      "confidence": "HIGH",
      "unknownReason": null
    },
    {
      "requirementId": "REQ-008",
      "status": "MATCHED",
      "matchBasis": "TRAINING",
      "explanation": "La formation intensive en cours, ajoutée à un parcours de spécialisation vers Java/Spring, constitue une preuve forte d’apprentissage continu.",
      "resumeEvidence": [
        {
          "source": "RESUME",
          "page": 1,
          "excerpt": "Currently completing intensive Fullstack Java / Angular / Cybersecurity training"
        },
        {
          "source": "RESUME",
          "page": 1,
          "excerpt": "Practical projects combining Angular frontend, Java backend, structured data, business logic and authorization flows."
        }
      ],
      "opportunityEvidence": [
        {
          "source": "OPPORTUNITY",
          "section": "Ton profil",
          "excerpt": "Tu aimes travailler en équipe et apprendre en continu."
        }
      ],
      "confidence": "HIGH",
      "unknownReason": null
    }
  ],
  "atsFit": {
    "status": "WARNING",
    "keywordCoveragePercent": 80.0,
    "matchedKeywords": [
      "Angular",
      "Java",
      "Agile/Scrum",
      "CI/CD"
    ],
    "missingKeywords": [
      "MongoDB"
    ],
    "parsingRisks": [],
    "limitations": [
      "Cette couverture de mots-clés ne représente pas une probabilité d’entretien ni le comportement d’un ATS spécifique.",
      "La correspondance Java repose principalement sur la formation et doit rester distincte d’une expérience professionnelle backend."
    ]
  },
  "recruiterFit": {
    "status": "WARNING",
    "twentySecondVerdict": "Le CV paraît immédiatement pertinent pour Angular et montre une transition crédible vers Java. Le principal doute porte moins sur la capacité technique que sur l’adéquation à un poste explicitement junior et sur l’absence de MongoDB.",
    "targetClarity": "STRONG",
    "relevanceVisibility": "STRONG",
    "evidenceStrength": "ADEQUATE",
    "seniorityCoherence": "WEAK",
    "strongestEvidence": [
      {
        "label": "Angular professionnel",
        "details": "Plusieurs expériences professionnelles Angular rendent la correspondance frontend immédiatement crédible.",
        "relatedRequirementIds": [
          "REQ-003"
        ],
        "resumeEvidence": [
          {
            "source": "RESUME",
            "page": 1,
            "excerpt": "UX/UI Designer & Front-End Developer Angular | Proxistore | 2020 - 2024"
          },
          {
            "source": "RESUME",
            "page": 1,